{
  "audit_id": "aud_synthetic_0002",
  "occurred_at": "2026-08-31T12:05:30Z",
  "actor": { "kind": "user", "id": "user_synthetic_0002" },
  "action": { "category": "publish", "name": "publish.meta_page.requested" },
  "tenant_context": {
    "workspace_id": "ws_synthetic_0002",
    "business_profile_id": "bp_synthetic_0002",
    "page_context_profile_id": "pc_synthetic_0002",
    "actor": { "kind": "user", "id": "user_synthetic_0002" },
    "request_id": "req_synthetic_0002",
    "correlation_id": "corr_synthetic_0002",
    "locale": "th-TH",
    "timezone": "Asia/Bangkok"
  },
  "correlation_id": "corr_synthetic_0002",
  "causation_id": "job_synthetic_0002",
  "outcome": "denied",
  "reason_key": "audit.publish.permission_denied",
  "error": {
    "code": "PUBLISH_PERMISSION_DENIED",
    "message_key": "error.publish.permission_denied",
    "category": "permission",
    "retryable": false,
    "correlation_id": "corr_synthetic_0002",
    "details": {}
  },
  "redaction": { "secret_redacted": true, "content_redacted": true, "pii_redacted": true },
  "retention": { "policy_ref": "retention.audit.security_action" },
  "details": {}
}
