{
  "audit_id": "aud_synthetic_0004",
  "occurred_at": "2026-08-31T14:00:00Z",
  "actor": { "kind": "user", "id": "support_synthetic_0004" },
  "action": { "category": "support", "name": "support.break_glass.granted" },
  "tenant_context": {
    "workspace_id": "ws_synthetic_0004",
    "actor": { "kind": "user", "id": "support_synthetic_0004" },
    "request_id": "req_synthetic_0004",
    "correlation_id": "corr_synthetic_0004",
    "locale": "th-TH",
    "timezone": "Asia/Bangkok"
  },
  "correlation_id": "corr_synthetic_0004",
  "outcome": "succeeded",
  "reason_key": "audit.support.break_glass_granted",
  "redaction": { "secret_redacted": true, "content_redacted": true, "pii_redacted": true },
  "retention": { "policy_ref": "retention.audit.support_access" },
  "details": {}
}
