{"audit_id": "aud_synthetic_0012", "occurred_at": "2026-08-31T13:20:00Z", "actor": {"kind": "user", "id": "user_synthetic_0003"}, "action": {"category": "delete", "name": "business_profile.record.deleted"}, "tenant_context": {"workspace_id": "ws_synthetic_0003", "business_profile_id": "bp_synthetic_0003", "actor": {"kind": "user", "id": "user_synthetic_0003"}, "request_id": "req_synthetic_0003", "correlation_id": "corr_synthetic_0003", "locale": "th-TH", "timezone": "Asia/Bangkok"}, "correlation_id": "corr_synthetic_0003", "outcome": "succeeded", "reason_key": "audit.delete.requested_by_workspace_owner", "change": {"before_ref": "snapshot:business_profile.bp-synthetic-0003.v7", "after_ref": "snapshot:business_profile.bp-synthetic-0003.v7"}, "redaction": {"secret_redacted": true, "content_redacted": true, "pii_redacted": true}, "retention": {"policy_ref": "retention.audit.deletion_record"}, "details": {}}
