{
  "audit_id": "aud_synthetic_0001",
  "occurred_at": "2026-08-31T11:42:00Z",
  "actor": { "kind": "user", "id": "user_synthetic_0001" },
  "action": { "category": "credential", "name": "secret.handle.revoked" },
  "tenant_context": {
    "workspace_id": "ws_synthetic_0001",
    "business_profile_id": "bp_synthetic_0001",
    "actor": { "kind": "user", "id": "user_synthetic_0001" },
    "request_id": "req_synthetic_0001",
    "correlation_id": "corr_synthetic_0001",
    "locale": "th-TH",
    "timezone": "Asia/Bangkok"
  },
  "correlation_id": "corr_synthetic_0001",
  "outcome": "succeeded",
  "reason_key": "audit.credential.revoked_by_workspace_owner",
  "change": {
    "before_ref": "snapshot:secret.handle.synthetic-0003.v1",
    "after_ref": "snapshot:secret.handle.synthetic-0003.v2"
  },
  "redaction": { "secret_redacted": true, "content_redacted": true, "pii_redacted": true },
  "retention": { "policy_ref": "retention.audit.security_action" },
  "details": {}
}
